{
  "schemaVersion": "vaos.provider.v2",
  "providerId": "windmill",
  "displayName": "Windmill",
  "adapterVersion": "1.0.0",
  "description": "Governed versioned-script execution provider for managed Windmill Cloud or approved self-hosted deployments.",
  "capabilities": [
    "code.execute"
  ],
  "deploymentModes": [
    "self-hosted",
    "managed-saas"
  ],
  "enabled": false,
  "qualification": {
    "state": "evaluation",
    "qualifiedCapabilities": [],
    "evidenceRefs": [],
    "validUntil": null
  },
  "routing": {
    "dataClassifications": [
      "public",
      "internal",
      "confidential"
    ],
    "riskClasses": [
      "low",
      "medium",
      "high"
    ],
    "licensingAllowed": true
  },
  "security": {
    "secretBinding": "required",
    "dataEgress": "controlled",
    "authModes": [
      "bearer"
    ],
    "callbackVerification": "none"
  },
  "execution": {
    "idempotency": "not-supported",
    "retrySemantics": "conditional",
    "verificationStrategy": "provider-readback",
    "healthProbe": "required",
    "rollbackMethod": "disable-provider"
  },
  "operations": {
    "retentionClass": "job-policy-bound",
    "dataResidency": [
      "IN"
    ],
    "costControl": "runtime-and-compute-budget"
  },
  "licensing": {
    "model": "Open-source/self-hostable platform",
    "redistributionReviewRequired": true,
    "notes": "Only approved script keys may map to versioned paths; inline/arbitrary execution is outside scope."
  },
  "notes": "Disabled/evaluation-only until provider identity, admission/backpressure, cancellation, artifact verification, cost controls and owner production authorization are independently qualified. Managed Windmill Cloud does not require local self-hosting."
}
