{
  "schemaVersion": "vaos.provider.v2",
  "providerId": "airbyte",
  "displayName": "Airbyte",
  "adapterVersion": "1.0.0",
  "description": "Governed data replication provider behind the VAOS fabric.",
  "capabilities": [
    "data.replicate"
  ],
  "deploymentModes": [
    "self-hosted",
    "managed-saas"
  ],
  "enabled": false,
  "qualification": {
    "state": "evaluation",
    "qualifiedCapabilities": [],
    "evidenceRefs": [],
    "validUntil": null
  },
  "routing": {
    "dataClassifications": [
      "public",
      "internal",
      "confidential"
    ],
    "riskClasses": [
      "low",
      "medium",
      "high"
    ],
    "licensingAllowed": true
  },
  "security": {
    "secretBinding": "required",
    "dataEgress": "controlled",
    "authModes": [
      "bearer"
    ],
    "callbackVerification": "none"
  },
  "execution": {
    "idempotency": "not-supported",
    "retrySemantics": "conditional",
    "verificationStrategy": "provider-readback",
    "healthProbe": "required",
    "rollbackMethod": "disable-provider-connection"
  },
  "operations": {
    "retentionClass": "replication-policy-bound",
    "dataResidency": [
      "connection-policy-bound"
    ],
    "costControl": "connection-and-volume-budget"
  },
  "licensing": {
    "model": "Open-source/self-managed or managed service",
    "redistributionReviewRequired": true,
    "notes": "Connector licensing, residency and commercial terms require connection-level qualification."
  },
  "notes": "Disabled/evaluation-only; governed connection keys, schema-change policy, lineage and data classification apply."
}
